{
 "schema": 1,
 "id": "wola.hub",
 "title": {
  "pl": "Wola",
  "ru": "район Воля"
 },
 "tileset": "ninja16",
 "controls": "walk",
 "size": [
  16,
  14
 ],
 "legend": {
  ".": {
   "tile": "cobble"
  },
  ",": {
   "tile": "road"
  },
  "g": {
   "tile": "kam_gzyms",
   "solid": true
  },
  "o": {
   "tile": "kam_okno",
   "solid": true
  },
  "O": {
   "tile": "kam_kwiaty",
   "solid": true
  },
  "x": {
   "tile": "kam_wall",
   "solid": true
  },
  "D": {
   "tile": "kam_drzwi"
  },
  "A": {
   "tile": "w_biuro_dach",
   "solid": true
  },
  "S": {
   "tile": "w_biuro",
   "solid": true
  },
  "L": {
   "tile": "w_biuro_okna",
   "solid": true
  },
  "E": {
   "tile": "w_biuro_wejscie",
   "solid": true
  },
  "<": {
   "tile": "w_markiza_l",
   "solid": true
  },
  "=": {
   "tile": "w_markiza_m",
   "solid": true
  },
  ">": {
   "tile": "w_markiza_r",
   "solid": true
  },
  "Q": {
   "tile": "w_salad_okno",
   "solid": true
  },
  "d": {
   "tile": "w_salad_drzwi"
  },
  "z": {
   "tile": "w_salad_szyld",
   "solid": true
  },
  "[": {
   "tile": "w_tram_l",
   "solid": true
  },
  "-": {
   "tile": "w_tram_m",
   "solid": true
  },
  "|": {
   "tile": "w_tram_d",
   "solid": true
  },
  "]": {
   "tile": "w_tram_r",
   "solid": true
  },
  "l": {
   "tile": "lamp_top",
   "solid": true
  },
  "i": {
   "tile": "lamp_pole",
   "solid": true
  },
  "P": {
   "tile": "signpost",
   "solid": true
  },
  "b": {
   "tile": "bench_l",
   "solid": true
  },
  "m": {
   "tile": "bench_m",
   "solid": true
  },
  "n": {
   "tile": "bench_r",
   "solid": true
  },
  "#": {
   "tile": "fence",
   "solid": true,
   "auto": true
  },
  "F": {
   "tile": "w_furtka"
  },
  "v": {
   "tile": "grass_flowers",
   "solid": true
  },
  "u": {
   "tile": "soil",
   "solid": true,
   "auto": true
  },
  "T": {
   "tile": "tree",
   "solid": true
  },
  "B": {
   "tile": "bush",
   "solid": true
  }
 },
 "defaultGround": ".",
 "layers": {
  "ground": [
   "gggggg..AAAAAAAA",
   "oxOxox..SLSSLSLS",
   "xOxxOx..LSSLSSLS",
   "oxxxox..SLSLSSLS",
   "xOxxOx.l<==>SLSS",
   "oxDxox.iQdQzSESS",
   "................",
   ",,,,,,,,,,[--|-]",
   ",,,,,,,,,,,,,,,,",
   ".P........bmn...",
   ".####F#####....T",
   ".#vvvvvvvv#..l..",
   ".#vuuvvuuv#..i..",
   ".##########..BT."
  ]
 },
 "spawns": {
  "default": [
   5,
   7
  ],
  "from_dom": [
   2,
   6
  ],
  "from_salad": [
   9,
   6
  ],
  "from_ogrod": [
   5,
   9
  ]
 },
 "objects": [
  {
   "type": "exit",
   "at": [
    2,
    5
   ],
   "to": "place:dom",
   "spawn": "from_dom"
  },
  {
   "type": "exit",
   "at": [
    9,
    5
   ],
   "to": "place:salad",
   "spawn": "from_salad"
  },
  {
   "type": "exit",
   "at": [
    5,
    10
   ],
   "to": "place:ogrod",
   "spawn": "from_ogrod"
  }
 ]
}
