{
  "id": "ch01.metro",
  "title": { "pl": "Metro Dworzec Wileński", "ru": "Метро «Дворец Виленьски»" },
  "tileset": "ninja16",
  "controls": "walk",
  "size": [20, 14],
  "defaultGround": ".",
  "legend": {
    ".": { "tile": "floor" },
    "#": { "tile": "wall", "solid": true, "auto": true },
    "|": { "tile": "gate", "solid": true },
    "=": { "tile": "stairs" }
  },
  "layers": {
    "ground": [
      "####################",
      "#..................#",
      "#..................#",
      "#...##......##.....#",
      "#...##......##.....#",
      "#..................#",
      "#..................#",
      "#.||.||.||..||.||..#",
      "#..................#",
      "#..................#",
      "#...##......##.....#",
      "#..................#",
      "#..................#",
      "#########=##########"
    ]
  },
  "spawns": { "default": [9, 11], "from_dzialka": [9, 12] },
  "objects": [
    { "type": "word", "id": "tablica_wyjscie", "at": [11, 12], "item": "lx.wyjscie", "ex": "listen", "sprite": "sign_exit" },
    { "type": "npc", "id": "pan_marek", "at": [15, 2], "facing": "down" },
    { "type": "exit", "at": [9, 13], "to": "ch01.dzialka", "spawn": "from_metro" }
  ]
}
