{
  "id": "ch01.bazar",
  "title": {
    "pl": "Bazar Różyckiego",
    "ru": "Базар Ружицкого"
  },
  "tileset": "ninja16",
  "controls": "walk",
  "size": [
    20,
    28
  ],
  "defaultGround": ".",
  "legend": {
    ".": {
      "tile": "cobble"
    },
    ",": {
      "tile": "road"
    },
    "g": {
      "tile": "kam_gzyms",
      "solid": true
    },
    "o": {
      "tile": "kam_okno",
      "solid": true
    },
    "O": {
      "tile": "kam_kwiaty",
      "solid": true
    },
    "x": {
      "tile": "kam_wall",
      "solid": true
    },
    "D": {
      "tile": "kam_drzwi"
    },
    "k": {
      "tile": "kiosk",
      "solid": true
    },
    "s": {
      "tile": "signpost",
      "solid": true
    },
    "l": {
      "tile": "lamp_top",
      "solid": true
    },
    "i": {
      "tile": "lamp_pole",
      "solid": true
    },
    "<": {
      "tile": "stall_l",
      "solid": true
    },
    "-": {
      "tile": "stall_m",
      "solid": true
    },
    ">": {
      "tile": "stall_r",
      "solid": true
    },
    "S": {
      "tile": "stall_s",
      "solid": true
    },
    "c": {
      "tile": "crate",
      "solid": true
    },
    "b": {
      "tile": "barrel",
      "solid": true
    },
    "q": {
      "tile": "sack",
      "solid": true
    },
    "h": {
      "tile": "chest",
      "solid": true
    },
    "t": {
      "tile": "trash",
      "solid": true
    },
    "1": {
      "tile": "clothes_nw",
      "solid": true
    },
    "2": {
      "tile": "clothes_ne",
      "solid": true
    },
    "3": {
      "tile": "clothes_sw",
      "solid": true
    },
    "4": {
      "tile": "clothes_se",
      "solid": true
    },
    "#": {
      "tile": "fence",
      "solid": true,
      "auto": true
    }
  },
  "layers": {
    "ground": [
      "gggggggggggggggggggg",
      "oxOxoxDxoxOxoxoxOxox",
      "xxxxxxDxxxxxxxxxxxxx",
      ".k..................",
      "....l.......l...s...",
      "....i.......i.......",
      ",,,,,,,,,,,,,,,,,,,,",
      ",,,,,,,,,,,,,,,,,,,,",
      ".......t............",
      "########......######",
      "#..................#",
      "#.<->...12...<->...#",
      "#.......34.........#",
      "#..................#",
      "#.c.b..........q.h.#",
      "#..................#",
      "#.<->....<->.c.S.b.#",
      "#..................#",
      "#..................#",
      "#.12..<->....<->...#",
      "#.34...............#",
      "#..................#",
      "#.q.b..S..c.b..<->.#",
      "#..................#",
      "#..................#",
      "#..................#",
      "#..................#",
      "##############..####"
    ]
  },
  "spawns": {
    "default": [
      6,
      3
    ],
    "from_peron": [
      6,
      3
    ],
    "from_wisla": [
      14,
      26
    ]
  },
  "objects": [
    {
      "type": "exit",
      "at": [
        6,
        2
      ],
      "to": "ch01.peron",
      "spawn": "from_bazar"
    },
    {
      "type": "trigger",
      "id": "kiosk",
      "at": [
        1,
        3
      ],
      "on": "tap",
      "do": [
        {
          "line": "d01.sign.zaraz"
        },
        {
          "line": "d01.kazik.street.zaraz"
        }
      ]
    },
    {
      "type": "trigger",
      "id": "tablica_bazar",
      "at": [
        16,
        4
      ],
      "on": "tap",
      "do": [
        {
          "line": "d01.sign.bazar"
        }
      ]
    },
    {
      "type": "npc",
      "id": "bobr",
      "at": [
        15,
        5
      ],
      "facing": "up"
    },
    {
      "type": "trigger",
      "id": "wejscie_bazar",
      "at": [
        8,
        10
      ],
      "size": [
        6,
        1
      ],
      "on": "enter",
      "once": true,
      "do": []
    },
    {
      "type": "npc",
      "id": "pani_hela",
      "at": [
        12,
        16
      ],
      "facing": "down"
    },
    {
      "type": "exit",
      "at": [
        14,
        27
      ],
      "to": "ch01.wisla",
      "spawn": "from_bazar",
      "if": {
        "flag": "beat.d01.bazar"
      }
    },
    {
      "type": "exit",
      "at": [
        15,
        27
      ],
      "to": "ch01.wisla",
      "spawn": "from_bazar",
      "if": {
        "flag": "beat.d01.bazar"
      }
    }
  ]
}
