{
  "id": "ch01.wisla",
  "title": {
    "pl": "Bulwar nad Wisłą",
    "ru": "Бульвар над Вислой"
  },
  "tileset": "ninja16",
  "controls": "walk",
  "size": [
    20,
    26
  ],
  "defaultGround": ".",
  "legend": {
    ".": {
      "tile": "grass"
    },
    ",": {
      "tile": "grass_flowers"
    },
    "~": {
      "tile": "water",
      "solid": true,
      "auto": true
    },
    "s": {
      "tile": "sand",
      "auto": true
    },
    "=": {
      "tile": "path",
      "auto": true
    },
    "g": {
      "tile": "kam_gzyms",
      "solid": true
    },
    "o": {
      "tile": "kam_okno",
      "solid": true
    },
    "O": {
      "tile": "kam_kwiaty",
      "solid": true
    },
    "x": {
      "tile": "kam_wall",
      "solid": true
    },
    "<": {
      "tile": "railing_l",
      "solid": true
    },
    "-": {
      "tile": "railing_m",
      "solid": true
    },
    ">": {
      "tile": "railing_r",
      "solid": true
    },
    "T": {
      "tile": "tree",
      "solid": true,
      "layer": "deco"
    },
    "b": {
      "tile": "bush",
      "solid": true
    },
    "l": {
      "tile": "gr_lamp_top",
      "solid": true
    },
    "i": {
      "tile": "gr_lamp_pole",
      "solid": true
    },
    "[": {
      "tile": "gr_bench_l",
      "solid": true
    },
    "|": {
      "tile": "gr_bench_m",
      "solid": true
    },
    "]": {
      "tile": "gr_bench_r",
      "solid": true
    },
    "c": {
      "tile": "gr_crate",
      "solid": true
    },
    "B": {
      "tile": "boat_l",
      "solid": true
    },
    "C": {
      "tile": "boat_r",
      "solid": true
    }
  },
  "layers": {
    "ground": [
      "gggggggggggggggggggg",
      "oxOxoxoxOxoxoxOxoxox",
      "xxxxxxxxxxxxxxxxxxxx",
      "~~~~~~~~~~~~~~~~~~~~",
      "~~~~~~~~~~~~~~~~~~~~",
      "~~~~~~~~~~~~~~~~~~~~",
      "~~~~~~~~~~~~~~~~~~~~",
      "~~~~~~~~~~~~~~~~~~~~",
      "~~~~~~~~~~~~~~~~~~~~",
      "ssssssssssssssssssss",
      "<---->ss<------>sss<",
      "..........c.........",
      "====================",
      "..l...........l.....",
      "..i..[|]......i.....",
      ".T......,....T....b.",
      ".......====.........",
      "..b....=..=......,..",
      "..,....=..=....T....",
      ".T.....=..=.........",
      ".......=..=...b.....",
      "....T..=..=.........",
      ".......=..=......T..",
      "..,....=..=....,....",
      ".......=..=.........",
      "TTTTTTT=..=TTTTTTTTT"
    ],
    "deco": [
      "                    ",
      "                    ",
      "                    ",
      "                    ",
      "                    ",
      "                    ",
      "      BC            ",
      "                    ",
      "                    ",
      "                    ",
      "                    ",
      "                    ",
      "                    ",
      "                    ",
      "                    ",
      "                    ",
      "                    ",
      "                    ",
      "                    ",
      "                    ",
      "                    ",
      "                    ",
      "                    ",
      "                    ",
      "                    ",
      "                    "
    ]
  },
  "spawns": {
    "default": [
      1,
      12
    ],
    "from_bazar": [
      1,
      12
    ],
    "from_dzialka": [
      8,
      24
    ]
  },
  "objects": [
    {
      "type": "exit",
      "at": [
        0,
        12
      ],
      "to": "ch01.bazar",
      "spawn": "from_wisla"
    },
    {
      "type": "npc",
      "id": "bobr",
      "at": [
        9,
        11
      ],
      "facing": "up"
    },
    {
      "type": "exit",
      "at": [
        8,
        25
      ],
      "to": "ch01.dzialka",
      "spawn": "from_wisla",
      "if": {
        "flag": "beat.d01.wisla"
      }
    },
    {
      "type": "exit",
      "at": [
        9,
        25
      ],
      "to": "ch01.dzialka",
      "spawn": "from_wisla",
      "if": {
        "flag": "beat.d01.wisla"
      }
    }
  ]
}
